created_at,id,clean_text,favorite_count,retweet_count,original_tweet,tweet_media,hashtag_text,mention_names,in_reply_to_screen_name,in_reply_to_status_id,is_quote_status,is_diplomatic,entities_mentioned
10/18/19 13:27,1.19E+18,"Spoke with Rabbi Cooper, Rabbi Hier, and Michele Alkin of @simonwiesenthal Center about @StateDept efforts to advance #religiousfreedom, an unalienable right all should cherish, and to combat anti-Semitism, a scourge all should fight. I am grateful for their work in these areas. ",1805,496,TRUE,photo,['religiousfreedom'],"['SimonWiesenthalCntr', 'Department of State']",,,FALSE,0,
10/18/19 8:15,1.19E+18,.@Netanyahu and I had a productive meeting on efforts to counter the Iranian regime’s malign influence as well as regional developments and other issues related to Israel’s security. ,2304,655,TRUE,photo,,['Benjamin Netanyahu'],,,FALSE,1,"['Israel','Iran']"
10/18/19 6:15,1.19E+18,"If you’re worried about Iran’s behavior now, imagine what Iran will do with advanced missiles, drones, tanks, and jets. The Security Council must renew the arms embargo.",4937,1507,TRUE,,,,SecPompeo,1.19E+18,FALSE,1,"['Iran','UN']"
10/18/19 6:15,1.19E+18,"Because of the flawed Iran deal, the UN arms embargo on Iran will expire in one year. Countries like Russia and China will be able to sell Iran sophisticated weapons. The Iranian regime will be free to sell weapons to anyone. This will trigger a new arms race in the Middle East.",6142,2331,TRUE,,,,,,FALSE,1,"['Iran','UN','Russia','China']"
10/17/19 22:08,1.18E+18,"Good to be in #Israel today and look forward to meeting and discussing a range of important issues, including regional developments and threats, and the security of America’s closest ally and partner. ",4460,1171,TRUE,photo,['Israel'],,,,FALSE,1,['Israel']
10/17/19 21:10,1.18E+18,China and Russia voted to put Nicholas Maduro on @UN_HRC. Farce. This is why we need the @statedept Commission on Unalienable Rights. Maduro is purposefully destroying the human rights of every Venezuelan. #EstamosUnidosVE ,5260,2688,TRUE,,['EstamosUnidosVE'],"['HRC SECRETARIAT', 'Department of State']",,,FALSE,1,"['China','Russia','Venezuela','UN']"
10/17/19 10:02,1.18E+18,"Saddened by the news that @RepCummings, a dedicated public servant, has passed away. Our prayers are with his family and friends at this difficult time.",4095,774,TRUE,,,['Elijah E. Cummings'],,,FALSE,0,
10/17/19 0:49,1.18E+18,Traveling today with @VP Pence to #Turkey for crucial discussions with @RTErdogan. ,6318,1529,TRUE,photo,['Turkey'],"['Vice President Mike Pence', 'Recep Tayyip Erdoğan']",,,FALSE,1,['Turkey']
10/16/19 21:40,1.18E+18,"Spoke with Turkish Foreign Minister @MevlutCavusoglu yesterday, urging Turkey to halt its military operation and return to a dialogue with the U.S. on security in Northeast Syria.",3638,1016,TRUE,,,['Mevlüt Çavuşoğlu'],,,FALSE,1,"['Turkey','Syria']"
10/16/19 20:35,1.18E+18,"More than 280 million people suffer from chronic hunger, including 94% of Venezuelans unable to cover daily food needs. Venezuelans refer to this as the “Maduro diet.” While the U.S. gives millions of $ in aid, Maduro uses food as a political weapon. #MaduroMustGo #WorldFoodDay ",5206,3411,TRUE,video,"['MaduroMustGo', 'WorldFoodDay']",,,,FALSE,1,['Venezuela']
10/16/19 19:59,1.18E+18,"We commend the creative thinking and commitment of the governments of El Salvador, Guatemala, and Honduras to reaching our shared goal.",1340,318,TRUE,,,,SecPompeo,1.18E+18,FALSE,1,"['El Salvador','Honduras','Guatemala']"
10/16/19 19:59,1.18E+18,"Earlier this year the U.S. temporarily suspended aid to El Salvador, Guatemala, &amp; Honduras until they took sufficient action to reduce the number of migrants coming to our border. Thanks to @realDonaldTrump’s policy we’re seeing great progress &amp; will resume targeted aid today.",3893,1088,TRUE,,,['Donald J. Trump'],,,FALSE,1,"['El Salvador','Honduras','Guatemala']"
10/15/19 22:19,1.18E+18,"Congratulations to Tunisia on well-run, secure, and timely presidential and legislative elections. We look forward to continuing our cooperation with Tunisia’s new government.",3874,787,TRUE,,,,,,FALSE,1,['Tunisia']
10/15/19 15:21,1.18E+18,"Spoke with Iraqi President Barham Salih yesterday to discuss our concerns over ongoing Turkish military incursion into Northeast Syria and the need for Turkey to stop its military offensive. I also affirmed our commitment to a strong, sovereign, and prosperous Iraq.",7600,2108,TRUE,,,,,,FALSE,1,"['Iraq','Turkey','Syria']"
10/14/19 22:20,1.18E+18,"This destabilizing operation by Turkey continues, and has now created a growing and disastrous humanitarian crisis. We remain committed to a political solution to the conflict in Syria in line with UNSCR 2254. Turkey’s unilateral actions led to these sanctions. ",2871,1200,TRUE,photo,,,SecPompeo,1.18E+18,FALSE,1,"['Turkey','Syria','UN']"
10/14/19 22:20,1.18E+18,"The U.S. is now implementing sanctions authorities related to #Turkey’s ongoing military offensive in northeast #Syria, which is endangering civilians and severely undermining the D-ISIS campaign.",6358,2057,TRUE,,"['Turkey', 'Syria']",,,,FALSE,1,"['Turkey','Syria','ISIS']"
10/13/19 13:12,1.18E+18,"Our Founding Fathers recognized that a strong navy was essential to our nation's security. That has not changed, and we are proud of @StateDept's longstanding and successful partnership with the finest sea force in the world. Happy birthday, @USNavy! #244NavyBday ",7788,1907,TRUE,photo,['244NavyBday'],"['Department of State', 'U.S. Navy']",,,FALSE,0,
10/12/19 20:37,1.18E+18,Grateful to our partners  for speaking out and urging restraint on this issue. ,1441,368,TRUE,,,,SecPompeo,1.18E+18,FALSE,0,
10/12/19 20:37,1.18E+18,Spoke with @ScottMorrisonMP and @MarisePayne on what's happening in Northeastern Syria and our shared concern about Turkey's unilateral military operation and potentially grave consequences for regional security.,2509,641,TRUE,,,"['Scott Morrison', 'Marise Payne']",,,FALSE,1,"['Syria','Turkey']"
10/12/19 18:37,1.18E+18,It was an honor to meet with former President Jimmy Carter and First Lady Rosalynn Carter. They are helping to build homes with @Habitat_org in Nashville. Faithful servants doing good work for America. ,2501,473,TRUE,photo,,['Habitat for Humanity'],,,FALSE,0,
10/12/19 17:00,1.18E+18,"I wish to congratulate @AbiyAhmedAli on this amazing achievement. Ethiopia has shown that peaceful relations with Eritrea are a top foreign policy priority, and the United States is committed to supporting Ethiopians on their path to a brighter future. ",2180,568,TRUE,,,['Abiy Ahmed Ali'],,,FALSE,1,['Ethiopia']
10/12/19 16:27,1.18E+18,Grateful that my call as a Christian to protect human dignity overlaps with America's centuries-old commitment to the same in our foreign policy. Dedicated to ensuring our diplomacy pursues this mission and guards our proud history of honoring and defending #religiousfreedom. ,12373,4274,TRUE,video,['religiousfreedom'],,,,FALSE,0,
10/12/19 14:39,1.18E+18,"Pleased John Sullivan has been nominated to serve as our Ambassador to #Russia. We've long sought a constructive relationship with Russia, and I'm confident John will effectively lead the effort to strengthen our cooperation.",5547,1405,TRUE,,['Russia'],,,,FALSE,1,['Russia']
10/11/19 22:35,1.18E+18,Spoke with @JY_LeDrian today about our shared concerns over the Turkish military incursion into northeast Syria. Grateful that France has spoken out on the issue. France is our strong partner on international security and we'll continue to work together to oppose global threats.,2257,636,TRUE,,,['Jean-Yves Le Drian'],,,FALSE,1,"['Turkey','France','Syria']"
10/11/19 22:11,1.18E+18,The Iranian regime must fundamentally change its behavior and act like a normal nation. Or it can watch its economy collapse.,3155,1033,TRUE,,,,SecPompeo,1.18E+18,FALSE,1,['Iran']
10/11/19 22:11,1.18E+18,The United States is deploying additional forces and military equipment to Saudi Arabia to enhance its defensive capabilities and to help restore deterrence against Iranian aggression.,5378,1791,TRUE,,,,,,FALSE,1,"['Saudi Arabia','Iran']"
10/11/19 19:30,1.18E+18,Religious persecution worldwide is intensifying. We must work together to secure freedoms of belief &amp; religious practice for all. Thanks to @theAACC for inviting me to speak at the Rise Up World Conference about our most foundational and cherished of unalienable rights. ,1336,412,TRUE,photo,,['AACC'],,,FALSE,0,
10/11/19 18:48,1.18E+18,"Around the world, more than 80% of people live in areas where #religiousfreedom is suppressed or denied. Inspired by the Christian mental health and ministry leaders I met with today in #Nashville who are committed to helping confront the impacts of this challenge. ",1253,407,TRUE,photo,"['religiousfreedom', 'Nashville']",,,,FALSE,0,
10/11/19 18:02,1.18E+18,We recognize the difficult decisions @Lenin and the Government of #Ecuador have taken to establish the basis for economic prosperity. We share Ecuador’s commitment to democracy &amp; dialogue as the best way to resolve differences peacefully for the benefit of all Ecuadorians.,2017,757,TRUE,,['Ecuador'],['Lenín Moreno'],,,FALSE,1,['Ecuador']
10/11/19 17:38,1.18E+18,"Our new Ambassador to South Africa, Lana Marks, will be a terrific U.S. diplomat. Good that the Senate confirmed her in a bipartisan vote—we look forward to her contribution to a new era of economic and strategic partnership between our two countries. ",1804,468,TRUE,,,,,,TRUE,1,['South Africa']
10/11/19 16:43,1.18E+18,We welcome @USTreasury’s Global #Magnitsky sanctions against Sudanese businessman Ashraf Seed Ahmed Al-Cardinal &amp; South Sudanese Kur Ajing Ater for their corrupt activities. The U.S. will never waver in its effort to target those who rob critical resources from vulnerable people.,1602,571,TRUE,,['Magnitsky'],['Treasury Department'],,,FALSE,1,"['Sudan','South Sudan']"
10/11/19 14:27,1.18E+18,"Our pursuit of #religiousfreedom for all is relevant not only abroad, but also at home. Thrilled to be in #Nashville, Tennessee, to meet with religious leaders about the United States’ unwavering commitment to defending this unalienable right around the world.",5339,1500,TRUE,,"['religiousfreedom', 'Nashville']",,,,FALSE,0,
10/11/19 11:31,1.18E+18,"If #Iran were serious about combatting terror financing and adhering to global anti-money laundering and terrorism financing standards (#AMLCFT), it would ratify the #PalermoConvention and the Terrorist Financing Convention immediately.",4418,1307,TRUE,,"['Iran', 'AMLCFT', 'PalermoConvention']",,,,FALSE,1,['Iran']
10/10/19 22:42,1.18E+18,The leaked letter does not accurately represent the United States’ position with respect to OECD enlargement. We are enthusiastic supporters of Brazil’s entry into this important institution and the United States will make a strong effort to support Brazil’s accession.,7268,1661,TRUE,,,,SecPompeo,1.18E+18,FALSE,1,"['OECD','Brazil']"
10/10/19 22:42,1.18E+18,"We have welcomed Brazil’s ongoing efforts regarding economic reforms, best practices, and a regulatory framework in line with the standards of the OECD.",7346,1513,TRUE,,,,SecPompeo,1.18E+18,FALSE,1,"['OECD','Brazil']"
10/10/19 22:42,1.18E+18,"Contrary to media reports, the United States, consistent with the March 19 Joint Statement from President @realDonaldTrump and President @jairbolsonaro, fully supports Brazil beginning the process to become a full member of the OECD.",23103,6444,TRUE,,,"['Donald J. Trump', 'Jair M. Bolsonaro']",,,FALSE,1,"['OECD','Brazil']"
10/10/19 18:05,1.18E+18,"Great meeting with Salvadoran Foreign Minister Hill @CancillerAleHT today.  Positive momentum in #ElSalvador on security, prosperity, and governance is very encouraging! ",1724,371,TRUE,photo,['ElSalvador'],['Alexandra Hill Tinoco'],,,FALSE,1,['El Salvador']
10/10/19 16:26,1.18E+18,"Today’s @USTreasury sanctions against Ajay Gupta, Atul Gupta, Rajesh Gupta &amp; Salim Essa make clear that those involved in corruption will face consequences. This action reaffirms the United States’ commitment to support the rule of law &amp; accountability in South Africa &amp; globally.",4625,1655,TRUE,,,['Treasury Department'],,,FALSE,1,['South Africa']
10/10/19 15:55,1.18E+18,Met with @kbsalsaud yesterday to discuss bilateral cooperation to confront the Iranian regime’s destabilizing behavior. The U.S. supports Saudi Arabia’s right to defend itself.  We also discussed Yemen and other regional issues. ,1632,536,TRUE,photo,,['Khalid bin Salman                  خالد بن سلمان'],,,FALSE,1,"['Iran','Saudi Arabia','Yemen']"
10/10/19 15:01,1.18E+18,"As part of the 8th U.S.-Colombia High Level Dialogue, @CarlosHolmesTru and I discussed our shared security, economic, and democratic governance priorities. So grateful to #Colombia for generously hosting Venezuelan refugees suffering the effects of the Maduro #Venezuela crisis. ",1096,389,TRUE,photo,"['Colombia', 'Venezuela']",['Carlos Holmes Trujillo'],,,FALSE,1,"['Colombia','Venezuela']"
10/9/19 16:58,1.18E+18,"The U.S.-#Japan alliance has never been stronger, thanks to @realDonaldTrump and @AbeShinzo’s leadership on the incredible new trade agreements signed on Monday. Looking forward to a bright future in U.S.-Japan trade and investment. ",3499,996,TRUE,,['Japan'],"['Donald J. Trump', '安倍晋三']",,,TRUE,1,['Japan']
10/9/19 15:53,1.18E+18,"In April, #ICC judges rightly rejected the request to investigate U.S. personnel in Afghanistan, calling it “inevitably doomed to failure.” The ICC prosecutor is wasting the ICC’s time with an appeal. Our policy on the ICC has not changed. ",1638,560,TRUE,,['ICC'],,,,FALSE,1,"['ICC','Afghanistan']"
10/9/19 12:01,1.18E+18,"Oil from the #AdrianDarya1 has been offloaded in Syria, proving that Iran lied to the UK and Gibraltar. This terrorist oil will fund Assad’s war and Iran’s sectarian violence. EU members should condemn this action, uphold the rule of law, and hold Iran accountable. ",4970,2162,TRUE,photo,['AdrianDarya1'],,,,FALSE,1,"['Syria','Iran','United Kingdom','Gibraltar','EU']"
10/8/19 20:55,1.18E+18,"Wishing all those observing #YomKippur a peaceful, meaningful, and easy fast. May you be inscribed in the Book of Life! G’mar Chatima Tova. ",1561,408,TRUE,photo,['YomKippur'],,,,FALSE,0,
10/8/19 19:35,1.18E+18,"Today, I am announcing visa restrictions on Chinese government and Communist Party officials believed to be responsible for, or complicit in, the detention or abuse of Uighurs, Kazakhs, or other Muslim minority groups in Xinjiang.",26530,11745,TRUE,,,,SecPompeo,1.18E+18,FALSE,1,['China']
10/8/19 19:35,1.18E+18,"China has forcibly detained over one million Muslims in a brutal, systematic campaign to erase religion and culture in Xinjiang. China must end its draconian surveillance and repression, release all those arbitrarily detained, and cease its coercion of Chinese Muslims abroad.",39106,16301,TRUE,,,,,,FALSE,1,['China']
10/8/19 1:16,1.18E+18,"Great speaking with #UK Foreign Secretary @DominicRaab. We discussed our intentions to negotiate an ambitious future free trade agreement, ways to counter #Iran’s malign influence in the Middle East, and Turkey’s plans to potentially invade Syria.",3174,821,TRUE,,"['UK', 'Iran']",['Dominic Raab'],,,FALSE,1,"['United Kingdom','Iran','Middle East','Turkey','Syria']"
10/7/19 21:08,1.18E+18,"Our partnerships in Europe remain critical to promoting peace, protecting unalienable rights, and advancing prosperity. Returned to Washington with the knowledge that our relationships are stronger and better able to meet the challenges we face. ",4519,1212,TRUE,video,,,,,FALSE,1,['Europe']
10/5/19 22:47,1.18E+18,"Happy to speak at the Stavros Cultural Center today. A strong and prosperous #Greece is good for the Greek people, and good for America. ",5440,1222,TRUE,video,['Greece'],,,,FALSE,1,['Greece']
10/5/19 19:40,1.18E+18,We have been working with the #HolySee to advance international #religiousfreedom worldwide for over 35 years. His Holiness @Pontifex is a key partner on this issue. I enjoyed our meeting this week. ,4230,1079,TRUE,video,"['HolySee', 'religiousfreedom']",['Pope Francis'],,,FALSE,1,['Holy See']
10/5/19 15:27,1.18E+18,"Thank you, @NikosDendias, for hosting me today. I look forward to strengthening the U.S.-#Greece relationship as we work together to promote prosperity in the Eastern Mediterranean. ",2435,596,TRUE,photo,['Greece'],['Nikos Dendias'],,,FALSE,1,"['Greece','Eastern Mediterranean']"
10/5/19 15:02,1.18E+18,Discussed our security cooperation with #Greece - a vital @NATO Ally and important partner - with Defense Minister Panagiotopoulos today. We believe that U.S.-Greece cooperation on defense &amp; security will only enhance Greece's ability to promote peace and stability in the region. ,2139,547,TRUE,photo,['Greece'],['NATO'],,,FALSE,1,"['Greece','NATO']"
10/5/19 11:36,1.18E+18,"Great opportunity to thank the personnel and families of @USEmbassyAthens for their hard work and commitment to advancing regional stability, promoting trade and investment, and protecting human rights in #Greece. Ευχαριστώ! ",1886,382,TRUE,photo,['Greece'],['U.S. Embassy Athens'],,,FALSE,0,
10/5/19 9:19,1.18E+18,"Good to see Prime Minister Mitsotakis today. Had a constructive discussion on economic reform, energy cooperation, &amp; other issues. #Greece is a pillar of stability in the region. The U.S. stands ready to partner with the new Greek government to build a prosperous future. ",2965,720,TRUE,photo,['Greece'],,,,FALSE,1,['Greece']
10/5/19 2:03,1.18E+18,"Wrapping up my first visit to both Montenegro and North Macedonia today. The United States will continue to support their respective efforts to advance stability, security, and prosperity throughout the region. ",7532,1764,TRUE,video,,,,,FALSE,1,"['Montenegro','North Macedonia']"
10/5/19 1:23,1.18E+18,Pleased to spend time with the men and women from @USEmbassyMNE! Grateful for your daily efforts to advance U.S.-#Montenegro relations and foster stability and prosperity in the Balkans. ,1108,268,TRUE,photo,['Montenegro'],['US Embassy Podgorica'],,,FALSE,1,"['Montenegro','Balkans']"
10/4/19 21:15,1.18E+18,"A true pleasure meeting with staff from @USEmbassySkopje this afternoon. Our @StateDept team works tirelessly to support the American people and advance U.S. interests, and Embassy Skopje is no exception. Thank you ",1948,422,TRUE,photo,,"['U.S. Embassy North Macedonia', 'Department of State']",,,FALSE,0,
10/4/19 19:35,1.18E+18,"Discussed U.S. support for North Macedonia’s accession to @NATO &amp; the #EU, implementation of Prespa Agreement, &amp; economic development with President Pendarovski at beautiful Lake Ohrid. Our relationship will grow stronger through mutual commitment to peace, security &amp; prosperity. ",1667,444,TRUE,photo,['EU'],['NATO'],,,FALSE,1,"['North Macedonia','NATO','EU']"
10/4/19 16:12,1.18E+18,"Today President @realDonaldTrump announced #Poland’s nomination for the Visa Waiver Program, which allows visa free travel to the U.S. for up to 90 days. Poland &amp; @USEmbassyWarsaw have worked hard to advance our business, tourism, &amp; people-to-people ties. ",3769,1077,TRUE,,['Poland'],"['Donald J. Trump', 'US Embassy Warsaw']",,,FALSE,1,['Poland']
10/4/19 9:48,1.18E+18,"In my meeting with President Djukanovic, we discussed the vibrant U.S.-#Montenegro relationship. #EU accession is the next step in securing a prosperous future, &amp; we have redoubled our efforts to help Montenegro take its rightful place within the Euro-Atlantic community. ",1557,355,TRUE,photo,"['Montenegro', 'EU']",,,,FALSE,1,"['Montenegro','EU']"
10/4/19 8:10,1.18E+18,"Just arrived in #Montenegro, and welcomed the opportunity to meet with President Dukanovic. As an Ally, partner, and friend of Montenegro, the United States is committed to this country’s long-term success. ",3631,701,TRUE,photo,['Montenegro'],,,,FALSE,1,['Montenegro']
10/4/19 7:03,1.18E+18,"I’m leaving Rome and the Holy See committed to further advancing #religiousfreedom, inspired by our strong relationships, connected to my family’s roots, and refreshed in my faith. Ciao, Italia. Next up: Montenegro. ",3643,802,TRUE,photo,['religiousfreedom'],,,,FALSE,1,"['Italy','Holy See']"
10/3/19 22:23,1.18E+18,"As a proud son of Abruzzo, I’m honored to visit my ancestors’ birthplace and to meet the wonderful people of Pacentro. More than 18 million Americans share Italian roots, and they continue to contribute to the story of American Greatness. ",3676,771,TRUE,photo,,,,,FALSE,1,['Italy']
10/3/19 21:24,1.18E+18,"Great conversation with Ambassador Eisenberg and members of Rome’s business community. The U.S. is Italy’s largest non-EU export market, and we have robust foreign direct investment. Our long-standing economic partnership is strong with great potential for the future. ",1665,414,TRUE,photo,,,,,FALSE,1,"['Italy','EU']"
10/3/19 20:24,1.18E+18,The United States and Holy See celebrate 35 years of working together to advance international #religiousfreedom worldwide. Enjoyed the opportunity to meet with His Holiness @Pontifex on this issue today. ,2026,520,TRUE,photo,['religiousfreedom'],['Pope Francis'],,,FALSE,1,['Holy See']
10/3/19 18:24,1.18E+18,We thank Ambassador Huntsman for his service at @USEmbRu and his efforts to advance U.S. foreign policy. We wish him the best in his future endeavors! ,1250,282,TRUE,photo,,['Посольство США в РФ'],,,FALSE,0,
10/2/19 23:50,1.18E+18,"Met with Cardinal Parolin and Archbishop Gallagher today. Grateful for the Vatican’s continued cooperation to advance religious freedom, protect religious minorities, end the humanitarian catastrophe in Syria, and address the suffering of the Venezuelan people.",4185,1029,TRUE,,,,,,FALSE,1,"['Holy See','Syria','Venezuela']"
10/2/19 23:39,1.18E+18,"It’s always my honor to meet and greet U.S. Embassy personnel and their families from @AmbasciataUSA, @USinHolySee, and @USUNRome. I’m proud of the hard
work being done by our great @StateDept team to promote America’s interests in the region. ",1385,338,TRUE,photo,,"['Ambasciata U.S.A.', 'U.S. in Holy See', 'USUNRome', 'Department of State']",,,FALSE,1,"['Italy','Holy See']"
10/2/19 23:12,1.18E+18,Today I thanked Ambassador Gingrich for championing our efforts to advance #religiousfreedom alongside the Holy See. The United States looks forward to continuing to work with the Vatican to advance interfaith dialogue and religious freedom around the world. ,2587,596,TRUE,photo,['religiousfreedom'],,,,FALSE,1,['Holy See']
10/2/19 20:32,1.18E+18,Securing and defending #religiousfreedom is not a choice; it's both a moral &amp; national security imperative. We value the opportunity to collaborate with faith-based organizations around the world as we reaffirm international commitments to protect this unalienable right for all. ,8110,2504,TRUE,video,['religiousfreedom'],,,,FALSE,0,
10/2/19 15:17,1.18E+18,"Productive meeting with @luigidimaio discussing our strong security, economic, and cultural ties with #Italy and the importance of Transatlantic unity in the face of global challenges. ",2085,568,TRUE,photo,['Italy'],['Luigi Di Maio'],,,FALSE,1,['Italy']
10/2/19 9:25,1.18E+18,"Was pleased to meet with Italian Prime Minister @GiuseppeConteIT to reaffirm the strength of the U.S.-Italy relationship and to discuss working together to face common challenges, including energy security and other global concerns. ",4042,919,TRUE,photo,,['Giuseppe Conte'],,,FALSE,1,['Italy']
10/2/19 9:02,1.18E+18,Great meeting with Italian President Mattarella. #Italy continues to be one of our greatest partners and we reaffirmed our commitment to joint U.S.-Italy efforts to counter emerging global threats. ,3654,823,TRUE,photo,['Italy'],,,,FALSE,1,['Italy']
10/2/19 4:30,1.18E+18,"Despite Iran FM Zarif’s promise to the UK that the #AdrianDarya1 would not deliver oil to Syria, it is now transferring oil off the Syrian coast. Will the world hold Iran accountable if this oil is delivered to Syria? ",5945,2699,TRUE,photo,['AdrianDarya1'],,,,FALSE,1,"['Iran','United Kingdom','Syria']"
10/1/19 14:27,1.18E+18,"Let me be clear: I will not tolerate such tactics, and I will use all means at my disposal to prevent and expose any attempts to intimidate the dedicated professionals whom I am proud to lead and serve alongside at the Department of State.",20229,8282,TRUE,,,,SecPompeo,1.18E+18,FALSE,0,
10/1/19 14:27,1.18E+18,"I’m concerned with aspects of the Committee’s request that can be understood only as an attempt to intimidate, bully, &amp; treat improperly the distinguished professionals of the Department of State, including several career FSOs. ",21351,9885,TRUE,photo,,,,,FALSE,0,
10/1/19 4:43,1.18E+18,"Wheels up, and heading to Europe. Our enduring partnerships in Europe are critical, and I look forward to productive conversations on a range of global issues, including protecting #religiousfreedom and advancing economic prosperity. First stop: Rome and the Holy See. ",8633,2694,TRUE,photo,['religiousfreedom'],,,,FALSE,1,"['Europe','Italy','Holy See']"
9/30/19 19:26,1.18E+18,"Today, the United States continued to take action in response to Russian attempts to influence U.S. democratic processes. Our clear warning: efforts by foreign actors to undermine democracy will face consequences. ",9056,3758,TRUE,,,,,,FALSE,1,['Russia']
9/30/19 14:16,1.18E+18,"We applaud the courage of Afghan voters, poll workers, and security forces who made #AfghanElections possible despite technical challenges and security threats. Afghanistan’s institutions must take all necessary steps to transparently tabulate results and investigate complaints.",3538,811,TRUE,,['AfghanElections'],,,,FALSE,1,['Afghanistan']
